id,created_at,user_name,user_location,full_text,user_followers_count,retweet_count,Candidat
1471380480276762626,Thu Dec 16 07:23:38 +0000 2021,Cyril SAMSON ,,"Twitter me propose de rpondre  un sondage  mais ta comme un problme avec les candidats propos Je veut dire il propose Nathalie Arthaud mis aucun candidat du Frexit 

sondage manipulation httpstco6ruFpk46kq",141,2,Arthaud Nathalie
1471101381872340995,Wed Dec 15 12:54:35 +0000 2021,tvbn,,SimoneInsoumise Azerty91752101 narthaud J espre que vous nirez pas faire barrage en votant Macron au 2me tour ,84,0,Arthaud Nathalie
1471178331412389890,Wed Dec 15 18:00:22 +0000 2021,Dominique Niorthe,,RT Cnajep Intervention de narthaud LutteOuvriere accueillie sur scne par CrajepNA Elections2022 Cnajep15Dec httpstcowaYPBwvQBw,145,1,Arthaud Nathalie
1471640881983889411,Fri Dec 17 00:38:22 +0000 2021,Monica JLM 2022 Matr 613 Disinfo,BORDEAUX FRANCE,RT MarieWe90229652 A droite je viens de compter 10 candidats entre la droite et lextrme droite  A gauche Poutou Arthaud Anasse Hida,3644,20,Arthaud Nathalie
1471286381695868931,Thu Dec 16 01:09:43 +0000 2021,Le Nir,Mindanao Philippines,narthaud Une femme prsidente en 2022  httpstcoisCnDm7Jro,10,0,Arthaud Nathalie
1471228218388668426,Wed Dec 15 21:18:36 +0000 2021,Xio,Chteau Noir,"RT hopoietes macron20h Nimporte quoi plutt que ce type en mai 2022 Arthaud Lassalle Mme Zemmour

Seule Pecresse son clone naur",177,5,Arthaud Nathalie
1471430860373172224,Thu Dec 16 10:43:49 +0000 2021,Le Tlgramme,Bretagne,Cest un sacr exemple de tnacit,140506,0,Arthaud Nathalie
1471224158247866369,Wed Dec 15 21:02:28 +0000 2021,Nathalie Arthaud,,Chapitre GiletsJaunes3ans violence violence violence et violence haine et hainevoil comment MacronTF1 parle de la colre de ceux qui se sont mobiliss pour leur pouvoir dachat La premire des violences cest la pauvret ,21098,39,Arthaud Nathalie
1471451524039684100,Thu Dec 16 12:05:56 +0000 2021,Sbastien,,Thiono5 narthaud GroupeSNCF Une ide comme a pourquoi ne pas faire la grve en faisant la gratuit du train  a touchera pas les voyageurs mais la direction qui verras sont CA  en baisse et l les syndicats  auront plus de poids il faut frapper ou a fait mal,3,0,Arthaud Nathalie
1471262417078398981,Wed Dec 15 23:34:29 +0000 2021,Feu Floyd,,"RT TF1LeJT Sur le grand Entretien dEmmanuel Macron

  narthaud   On a eu droit  2h dexercice dautosatisfaction La ralit",6,7,Arthaud Nathalie
1471541928600735746,Thu Dec 16 18:05:10 +0000 2021,Jousserandot Rgis ,FrancheComt France,narthaud Ca sappelle du nudge,45,0,Arthaud Nathalie
1471502167475310601,Thu Dec 16 15:27:10 +0000 2021,herbaut,,toyette2 narthaud Et la CFDT ne dispose pas peut tre dune caisse de grve  peut tre ce nest pas une lgende ,0,0,Arthaud Nathalie
1471769951883116548,Fri Dec 17 09:11:15 +0000 2021,Bilou,ConflanssainteHonorine,MarieWe90229652 54Lilly Sans compter que beaucoup nauront pas les parainnages pour linstant Hidalgo et peuttre Arthaud les ont Donc perso plus il y a de tentatives de candidatures mieux cest les gens feront le tri,3339,0,Arthaud Nathalie
1471442031188885510,Thu Dec 16 11:28:12 +0000 2021,Biddy Bold,,narthaud LutteOuvriere  vous engagerezvous contre la SouffranceAnimale pour une interdiction de llevage des poules en cages L214 PolAnimaux httpstcoapNk9y3DQO EndTheCageAge Animaux2022,445,0,Arthaud Nathalie
1471207464569823236,Wed Dec 15 19:56:07 +0000 2021,Sylvain Vedrenne,Somewhere in time,RT espoirRIC2022 lecrayonmedia AnasseKazib RevPermanente narthaud Et noubliez pas Clara Egger la candidate de la Dmocratie  la,82,4,Arthaud Nathalie
1471505305041133581,Thu Dec 16 15:39:38 +0000 2021,RebelLionNonOfficiel,France,narthaud FredLille Et cette fourberie consistant  se faire passer pour le gentil en se mettant du cot des rleurs  la fin aprs avoir bien laiss pourrir la situation Idem avec les hospitaliers quand les urgences sont victimes de gens en colre parce que plus de patients que de personnel,1122,0,Arthaud Nathalie
1471115520820797446,Wed Dec 15 13:50:46 +0000 2021,tvbn,,FailNino Azerty91752101 narthaud Oui on est daccord mais votre graphique date de mai 2021 Zemmour tait dans face  linfo,84,0,Arthaud Nathalie
1471743405650755589,Fri Dec 17 07:25:46 +0000 2021,Romain,JuvisysurOrge France,Lockash1 ericmorand narthaud Du coup on dit oui monsieur et on subit pendant 40ans ,515,0,Arthaud Nathalie
1471169873585840135,Wed Dec 15 17:26:45 +0000 2021,Fdration des Aroven,France, il faut dabord mettre les moyens et les ressources suffisantes pour que la jeunesse sen empare et fasse changer les choses narthaud,532,0,Arthaud Nathalie
1471096341187248128,Wed Dec 15 12:34:34 +0000 2021, Je suis en Mode Guerre  macron,,"narthaud Non cest le monde de EmmanuelMacron
Un petit mot pour battre
Macron Zemmour Pecresse et Hidalgo
Rejoignez Melenchon vous allez pas cracher et dire quil est de droite
Vous pousez 80  de ces ides
Alors pensez au peuple qui souffre
Merci",958,0,Arthaud Nathalie
1471506073035042825,Thu Dec 16 15:42:41 +0000 2021,Maxime Frhel,France,PunkzCy narthaud Techniquement je demande rien du tout Mais cest normal que nous devrions payer le prix de leurs revendications  Je ne pense pas La direction de la SNCF voire le Gouv sen tapent ils ne sont pas touchs par ces grves,495,0,Arthaud Nathalie
1471585778383872007,Thu Dec 16 20:59:24 +0000 2021,I,Armorique du sud,"Nathalie Arthaud amp Philippe Poutou lanceurs dArlette  

CEstToutPourCeSoir JeSuisAFond",1172,0,Arthaud Nathalie
1471472825458429956,Thu Dec 16 13:30:34 +0000 2021,Papy Marcus woke islamogauchiste,Rgion Parisienne,MichelNacou narthaud a ne changerait rien Questce qui changerait selon vous ,314,0,Arthaud Nathalie
1471132509677264896,Wed Dec 15 14:58:17 +0000 2021,Evan Plard,,FrankoZ29 narthaud Votre discours vaut pour les mlenchon et autres hidalgo Arthaud nest pas de ceuxl Je ne voterais pas pour elle et je ne suis pas pour ses ides mais elle fait partie des derniers politiciens honntes,30,0,Arthaud Nathalie
1471356818576363520,Thu Dec 16 05:49:36 +0000 2021,Kerfany29,,ValflynReturn pjacquemain Tout  fait les rac considrent que la gauche  Mlenchon  Poutou  Arthaud jai sciemment retir Montebourg  Hidalgo  Jadot qui rejoindront Macron   la 1re occasion nont pas le droit dexpression ou  lextrme limite  la nuit entre 2h et 3h,367,1,Arthaud Nathalie
1471524207586652166,Thu Dec 16 16:54:45 +0000 2021,elisa et cabochard stan account,Un endroit cool,ericmorand narthaud Parce que les grves ne font plus changer les choses,33,0,Arthaud Nathalie
1471444072976072718,Thu Dec 16 11:36:19 +0000 2021,Maxime Frhel,France,"narthaud Quelle indcence Cest donc a la rvolution  Faire chier ceux et celles qui vont retrouver leur famille pour Nol et qui nont rien demand 
Pas besoin de meilleur argument pour se rjouir de larrive de la concurrence",495,0,Arthaud Nathalie
1471218948872019980,Wed Dec 15 20:41:45 +0000 2021,Franoise  TerritoiresDeProgres ,France,narthaud Nonmais les hpitaux sont dlabrs et mal diriges mais les prsidents prcdents ont enfonc le bateauRGPP,4765,0,Arthaud Nathalie
1471175653512863745,Wed Dec 15 17:49:43 +0000 2021,CNAJEP,12 rue Tolain 75020 paris,RT DNiorthe Liza Merchaoui coordinatrice du CrajepNA accueille narthaud lors de lvnement mis en place par le Cnajep  Plaidoyer ,3862,1,Arthaud Nathalie
1471608044782034946,Thu Dec 16 22:27:53 +0000 2021,sardine94,,"RT sardine94 miher73260 narthaud il va falloir rviser vos classiques que vous avez appris on dirait par coeur 
les fonctionnaires n",1631,1,Arthaud Nathalie
1471529462319788038,Thu Dec 16 17:15:38 +0000 2021,Alexis Rjasse,Nevers,"Olivierpseudo deliberahoc EnthovenR Non aucune nest cologiste
Et vous avec oubli N Arthaud",86,0,Arthaud Nathalie
1471461725828493315,Thu Dec 16 12:46:28 +0000 2021,Frederic,,narthaud Merci,0,0,Arthaud Nathalie
1471749990913609729,Fri Dec 17 07:51:56 +0000 2021,Stella,,Jonathmcfly PlusUnIdealiste narthaud AHcCamille Oui cest bien davoir la version en rel car jentends 52 ans 54 ans,2277,0,Arthaud Nathalie
1471217832570544130,Wed Dec 15 20:37:19 +0000 2021,Matthieu,HautsdeSeine IledeFrance,narthaud Cest vrai,817,0,Arthaud Nathalie
1471520994334593028,Thu Dec 16 16:41:59 +0000 2021,JeanPhilippe Viaud,ParisBiarritzGarazi,"Oui et pour y arriver nous lecteurs dune gauche humaniste sociale et cologistevous appelons  la PrimairePopulaire pour avoir toutes les chances dtre au 2me tour en 2022 yjadot
 JLMelenchon 
FabienRoussel PhilippePoutou narthaud ChTaubira 
httpstcoovLIRO8rV8 httpstcoyll1j1M5Ne",2127,1,Arthaud Nathalie
1471413040948129792,Thu Dec 16 09:33:01 +0000 2021,Michal Le Bourlout,IledeFrance France,RT SRMLeMonde Le candidat FabienRoussel sengage sur lappel des socits de journalistes pour une libre couverture de la campagne pr,53,33,Arthaud Nathalie
1471262729226887177,Wed Dec 15 23:35:44 +0000 2021,Thoricien des piles,,PostLululef VnrntrghmB AnasseKazib FabienRoussel convictions personnelles Cest le cas avec ceux qui INDIVIDUELLEMENT soutiennent Mlenchon par soucis dunit par exemple ou Poutou et Arthaud pour des raisons idologiques Mais dans ce cas ces lus sont en contradiction avec la centralisme dmocratique et agissent contre,10,0,Arthaud Nathalie
1471256375867101185,Wed Dec 15 23:10:29 +0000 2021,,04 100,Nathalie Arthaud une reine comme on en fait plus,284,0,Arthaud Nathalie
1471624335689400327,Thu Dec 16 23:32:37 +0000 2021,Eric BATTIER,Entre Dauphin et  Camargue ,"francoiscarpit1 LarrereMathilde Pas reconnu le programme de Poutou ni dArthaud
Donc pas de gauche ",989,0,Arthaud Nathalie
1471157019763744773,Wed Dec 15 16:35:40 +0000 2021,Lemonnier Jean Pierre,HauteNormandie France,alekosdu78 narthaud Ne pas oublier que Lnine a fait un coup dEtat pardessus le coup dEtat Il a dit  quand nous aurons le pouvoir nous ne le lcherons plus Et ils en ont prix pour 70 ans de dictature SUR le proltariat Dommage au dbut il y avait de lide ,28,0,Arthaud Nathalie
1471602628190781452,Thu Dec 16 22:06:22 +0000 2021,sardine94,,redmapping miher73260 narthaud effectivement le dcompte des jours de grve semble trs alatoire et cratif  lEN a doit tre encore les russes ,1631,0,Arthaud Nathalie
1471763990661451780,Fri Dec 17 08:47:34 +0000 2021,Alan37  ,Tours ,miher73260 MLI1051 narthaud Faux moi je travaille  la sncf jai 28 jours de CP et je partirais  la retraite  62 ans voir 64 ans si le gouvernement vote la rforme des retraites  Et jai 5 RTT tout comme dans le prive Donc arrtons de croire la cour des comptes qui donne une moyenne des annes 80,99,0,Arthaud Nathalie
1471204437569978370,Wed Dec 15 19:44:06 +0000 2021,Valerie Dumeige,Paris France,"RT EditionsArthaud Reportages en Isral
Lcrivain Joseph Kessel a sillonn Isral  trois reprises tout au long de sa carrire de repo",450,1,Arthaud Nathalie
1471198841785532422,Wed Dec 15 19:21:52 +0000 2021,JDrake,,"narthaud Vous ainsi que ceux qui seront  nouveau classs de petits candidats il va falloir vous battre
Beaucoup de citoyens je pense peuvent vous soutenir dans ce combat httpstcoaBzyAxOmb0",863,0,Arthaud Nathalie
1471411957609730051,Thu Dec 16 09:28:42 +0000 2021, Jade ,France,delacale narthaud Poutou excelle il sera promu dans les cuisines du palais pour faire la plonge ,721,0,Arthaud Nathalie
1471731137349398528,Fri Dec 17 06:37:01 +0000 2021,La Montagne,FRANCE,"PuydeDome gastronomie 
 De la fve de cacao  la tablette Mathieu Arthaud fabrique son chocolat  CournondAuvergne

 httpstcoT4dPs9590w httpstcoAE119qsJBw",99938,1,Arthaud Nathalie
1471572663747416070,Thu Dec 16 20:07:18 +0000 2021,El Conductor Professor,Ple nord,adrienvindry narthaud Et vous vous faites quoi ,355,0,Arthaud Nathalie
1471601221387575299,Thu Dec 16 22:00:46 +0000 2021,sardine94,,"MaximeFO narthaud donc en fait vous faites partie de ceux qui ont demand quelque chose  
 savoir le 
dmantlement de la sncf au profit du moins disant dun priv qui ne veut que le dj rentable et va continuer  dtruire",1631,0,Arthaud Nathalie
1471736837345624065,Fri Dec 17 06:59:40 +0000 2021,Un cri dans le dsert ,,dangieit RenaudSand Prof dhistoire de lycee pro Y a plusieurs niveaux dans les concours de profs On peut pas demander la lune non plus surtout  un prof fanatis au communisme et  lislamogauchisme Une autre est  peu pres sur le meme niveau intellectuel  Nathalie Arthaud,239,1,Arthaud Nathalie
1471294779191439367,Thu Dec 16 01:43:05 +0000 2021,Strabysme catgirl camionneuse,Bretagne France,"Merrypostfurry PlasticPoulpe romeolhomo Cest pas ceux qui vont voter Poutou et Kazib qui vont faire lire qui que ce soit en fait cest un lectorat qui nlirais personne dautre  part Arthaud et  la trs grande limite JLM

Cest pour a notamment que lunion de la gauche est inutile  les lectorats sont diff",254,0,Arthaud Nathalie
1471225954492198915,Wed Dec 15 21:09:36 +0000 2021,Rfrent Local UPR Rhne,Rhne,"narthaud Et Franois Asselineau de lupr 
0 minutes 
Le pluralisme est  son apoge 
Il doit falloir avoir les 06 des milliardaires pour pouvoir passer au 20 heures",237,0,Arthaud Nathalie
1471540726370652168,Thu Dec 16 18:00:23 +0000 2021,Manzoku,,EvergreeN945 Thiono5 narthaud GroupeSNCF a cest ta rponse magique on dirait la petite phrase magique qui permet de justifier cette grve infme en priode de fte ET de covid ,0,0,Arthaud Nathalie
1471135417420423171,Wed Dec 15 15:09:50 +0000 2021,MPEMdia,Europe  France,"RT CollectifINPD thread
StopConcentrationDesMedias les candidats vous proposez quoi 
emmanuelmacron vpecresse yjadot montebourg",946,9,Arthaud Nathalie
1471459352938786820,Thu Dec 16 12:37:02 +0000 2021,Dust,,"narthaud   la grve est la dernire option 
Si il y a grve  cest quil ny a peut tre pas eu dcoute ou que lon a pris de haut des demandes souvent lgitimes httpstco1PD5BIrNRp",26,1,Arthaud Nathalie
1471153251731058688,Wed Dec 15 16:20:42 +0000 2021,Carlo Goldoni,,RT PerspCommuniste AnasseKazib FabienRoussel Philippe Poutou Nathalie Arthaud et dautres  gauche nont pas besoin des parrainages,678,5,Arthaud Nathalie
1471748220409757699,Fri Dec 17 07:44:54 +0000 2021,Romain,JuvisysurOrge France,Lockash1 ericmorand narthaud Lesquels  Si vous en avez on prend  car perso perdre des thunes tout les ans pour essayer de garder un minimum de vie de famille a me gonfle aussi,515,0,Arthaud Nathalie
1471132679257169923,Wed Dec 15 14:58:57 +0000 2021,Evan Plard,,Argele3 narthaud Tu viens de comprendre le concept dopposition Mes flicitations,30,0,Arthaud Nathalie
1471782754769641477,Fri Dec 17 10:02:07 +0000 2021,little khoya ,FRANCE,RT MarieWe90229652 A droite je viens de compter 10 candidats entre la droite et lextrme droite  A gauche Poutou Arthaud Anasse Hida,1007,20,Arthaud Nathalie
1471568617510965248,Thu Dec 16 19:51:13 +0000 2021,Cbapt JLM2022,AbsurdistanAutoritaire,RT MarieWe90229652 A droite je viens de compter 10 candidats entre la droite et lextrme droite  A gauche Poutou Arthaud Anasse Hida,790,20,Arthaud Nathalie
1471510234254299142,Thu Dec 16 15:59:13 +0000 2021,Mm Mi,,narthaud Jai tendance  soutenir mais pointer  leur nez juste au vacance de Nol a soule,0,0,Arthaud Nathalie
1471213537318125576,Wed Dec 15 20:20:15 +0000 2021,Picsou Leroi,,"narthaud Tout a pour tre dfait par le bloc de gauche fond le 22 janvier 2022 qui unit LONPAPCFLFIEELV

Rire jaune",39,0,Arthaud Nathalie
1471407651472953345,Thu Dec 16 09:11:36 +0000 2021,Fab,LElyse ,narthaud Les mougeons iront valider le mandat prsidentiel qui donnera les pleins pouvoirs au dictateur de lElyse injusticiable et irrvocable dans un tat durgence permanent et de nondroit qui habilite lexcutif  lgifrer par ordonnances pour renforcer sa dictature Beeeh beeh,65,0,Arthaud Nathalie
1471483553187835908,Thu Dec 16 14:13:12 +0000 2021,random soyboy, ,des fois tu prends un caf avec un pote et il te dit mais cest pas Nathalie Arthaud,496,0,Arthaud Nathalie
1471141336371843080,Wed Dec 15 15:33:21 +0000 2021,ParceQueCestNotreProjet AVECEMMANUELMACRON,,lionpapy EmmanuelMacron a plus peur de narthaud que de valoche ,3056,0,Arthaud Nathalie
1471504589094490116,Thu Dec 16 15:36:47 +0000 2021,Biodgradable,,narthaud Maatnefer1 Oui mais une grve gnrale ce serait mieux  Tous les services publics en Grve reconductible  Lutte finale  ,77,0,Arthaud Nathalie
1471600034617647104,Thu Dec 16 21:56:03 +0000 2021,sardine94,,"RT KampfDe narthaud Domiala Ouais et te prsenter 10 fois pr diviser les voix de gauche na rien chang
Mais tu vas persister vide",1631,1,Arthaud Nathalie
1471265275093868544,Wed Dec 15 23:45:51 +0000 2021,Stanislas Noyer,,RT bifo Donc opinionway a eu la bonne ide dajouter une 8e candidate des gauches  llection prsidentielle pour mesurer les intenti,586,1,Arthaud Nathalie
1471226454633500676,Wed Dec 15 21:11:35 +0000 2021,hDes Allimes Hlne ,,"RT CollectifINPD thread
StopConcentrationDesMedias les candidats vous proposez quoi 
emmanuelmacron vpecresse yjadot montebourg",2530,9,Arthaud Nathalie
1471743592427405321,Fri Dec 17 07:26:30 +0000 2021,elisa et cabochard stan account,Un endroit cool,RomainRERC ericmorand narthaud Nn mais on trouve des vraies solutions,33,0,Arthaud Nathalie
1471573582216052738,Thu Dec 16 20:10:57 +0000 2021,Menestrel Zorol,Pays de loire ,ElConductor14 narthaud Aucun rapport jai t artisan et je suis salari dans le btiment alors croyer le ou non je sais ce que cela veut dire de transpirer ,147,0,Arthaud Nathalie
1471383160550215680,Thu Dec 16 07:34:17 +0000 2021,  Lise Bouvet,Paris France,RT PerspCommuniste AnasseKazib FabienRoussel Philippe Poutou Nathalie Arthaud et dautres  gauche nont pas besoin des parrainages,2436,5,Arthaud Nathalie
1471778725889036290,Fri Dec 17 09:46:07 +0000 2021,herbaut,,MLI1051 narthaud Ah ce sont de mauvais fonctionnaires alors  Le statut des cheminots ne faudraitil pas le changer car vous avez vu  le train maintenant nest plus  vapeur qui paye le public  ou le priv  pour des gens qui sont privilgis qui osent bloquer le pays vous tes srieux,0,0,Arthaud Nathalie
1471764690002980869,Fri Dec 17 08:50:20 +0000 2021,Flo Seagal,Lyon,miher73260 MLI1051 narthaud Et vous y croyez vraiment   httpstco0UENeT5Hv6,25,0,Arthaud Nathalie
1471742874630959107,Fri Dec 17 07:23:39 +0000 2021,Sampieru Corsu,Capicorsu  Minervois,RT MarieWe90229652 A droite je viens de compter 10 candidats entre la droite et lextrme droite  A gauche Poutou Arthaud Anasse Hida,152,20,Arthaud Nathalie
1471557720323108874,Thu Dec 16 19:07:55 +0000 2021, Edge,pas loin de Paris en vrai,Toi tes un spcimen mon grand qui va dbattre avec lextrme droite  qui  Cest Arthaud ou cest Meluche  Arrtez de sortir vos neries vous tes des pitres httpstcogloz9JuyZx,236,0,Arthaud Nathalie
1471763045902864385,Fri Dec 17 08:43:48 +0000 2021,Il Principe,Lyon France,Thiono5 narthaud GroupeSNCF Si les voyageurs et le peuple franais en gnral les soutenaient il ny aurait pas besoin de faire grve aussi longtemps Lopinion publique importe vous les mprisez ils ne vont pas sacrifier leur niveau de vie pour vous,70,0,Arthaud Nathalie
1471639751946129409,Fri Dec 17 00:33:53 +0000 2021,Djadja,,"L election de Macron 2017 semble avoir t truque
1ere vido  httpstco3RJG4KUWOK
2eme video 
httpstcouZE8LvHRcE

JLMelenchon jeanlassalle MLPofficiel PhilippePoutou dupontaignan UPRAsselineau benoithamon narthaud JCheminade",255,0,Arthaud Nathalie
1471251739097636867,Wed Dec 15 22:52:03 +0000 2021,Sophie Grassano,Paris ,"RT ADMDFRANCE Presidentielle2022  Premire rponse  notre lettre dinterpellation sur le droit de mourir dans la dignit 
La candida",561,20,Arthaud Nathalie
1471445284542627842,Thu Dec 16 11:41:08 +0000 2021,Georges Daniel,,RT cyrilSAMSON4 Twitter me propose de rpondre  un sondage  mais ta comme un problme avec les candidats propos Je veut dire il propo,1847,2,Arthaud Nathalie
1471247890844684292,Wed Dec 15 22:36:46 +0000 2021,Nathalie Arthaud,,Macron20h ne parle mme pas des Salaires   Il faudra se rappeler que le pays tient tout entier sur des femmes et des hommes que lconomie reconnat et rmunre si mal avait il dit Pour lui ctaient des mots en lair Pas pour les aides  domicile,21098,41,Arthaud Nathalie
1471780962493251589,Fri Dec 17 09:55:00 +0000 2021,herbaut,,KypFlo MLI1051 narthaud pose la question  un cheminot de son salaire et des avantages tu tombera de larmoire nayez pas honte moi jai pas honte de ce que je gagne je travail dans le priv et je ne suis pas aid par les impts des franais et je ne fait pas ma pleureuse pour rclamer 1000,0,0,Arthaud Nathalie
1471766165613600768,Fri Dec 17 08:56:12 +0000 2021,54LILLY  LAvenir en Commun,,RT MarieWe90229652 A droite je viens de compter 10 candidats entre la droite et lextrme droite  A gauche Poutou Arthaud Anasse Hida,7771,20,Arthaud Nathalie
1471760434546024454,Fri Dec 17 08:33:26 +0000 2021,Compte Institutionnel nonOfficiel,Lyon France,Anatolie37 MARCLANDES40 BFMTV Cela fait 40 de convaincus et les 60 sont  repartir entre PhilippePoutou ZemmourEric MLPofficiel JLMelenchon AnneHidalgo yjadot narthaud montebourg vpecresse fphilippot a va leur faire des miettes  se partager,515,0,Arthaud Nathalie
1471608941012525071,Thu Dec 16 22:31:27 +0000 2021,ProAnima,Europe,"EngagementAnimaux

 ce jour 5 candidats se sont dj manifests et tudient nos 22 mesures  AnneHidalgo narthaud JLMelenchon  yjadot HeleneThouy  
 
Retrouvez la liste des candidats sur la plateforme dengagement   httpstco7rHC2hAzR5

Presidentielle2022",2571,1,Arthaud Nathalie
1471577125098602501,Thu Dec 16 20:25:01 +0000 2021,  lespatriotes agirenorientorg,Samarobriva,RT espoirRIC2022 lecrayonmedia AnasseKazib RevPermanente narthaud Et noubliez pas Clara Egger la candidate de la Dmocratie  la,2312,4,Arthaud Nathalie
1471391212368240641,Thu Dec 16 08:06:16 +0000 2021,Patrick Chasserio,France,Jusque l franceinter  tait ma radio prfre mais depuis ce matin et la prsence du raciste et fasciste Z   Cest fini Jespre que PhilippePoutou et narthaud  auront le mme temps dantenne GMeurice,595,0,Arthaud Nathalie
1471434449229389825,Thu Dec 16 10:58:05 +0000 2021,Fabrice,,narthaud Cest vrai le charbon  la pelle cest dur aussi,57,0,Arthaud Nathalie
1471441289673682950,Thu Dec 16 11:25:16 +0000 2021,Papy Marcus woke islamogauchiste,Rgion Parisienne,Thiono5 narthaud GroupeSNCF Quel service public  La SNCF est une socit anonyme et les cheminots ne sont pas fonctionnaires Faudrait savoir  Vous voulez continuer  bnficier de service public ou vous voulez copier les entreprises prives ,314,0,Arthaud Nathalie
1471764945725493249,Fri Dec 17 08:51:21 +0000 2021,LEGRAND Maxime,,miher73260 narthaud Quand aux chiffres de la cours des comptes on est un peu habitu Des valeurs donnes sans explications et quand tu creuses un peu tu taperois quils additionnent tout et nimporte quoi pourvu que le public incrimin passe pour des privilgi,7,0,Arthaud Nathalie
1471552333263814657,Thu Dec 16 18:46:31 +0000 2021,Jihen El Hasnaoui,paris,narthaud A part critiquer quelles sont vos ides,16,0,Arthaud Nathalie
1471529268572213259,Thu Dec 16 17:14:51 +0000 2021,herbaut,,toyette2 narthaud Je vous invite  lire ce message et vous comprendrez httpstcoZ1IgzKbj0F,0,0,Arthaud Nathalie
1471505065261207559,Thu Dec 16 15:38:41 +0000 2021,Tarrega,France,narthaud LutteOuvriere vous engagerezvous contre la SouffranceAnimale pour une interdiction de llevage des poules en cages L214 PolAnimaux httpstcoiQjsKLI1rz EndTheCageAge Animaux2022,26,0,Arthaud Nathalie
1471503527469993996,Thu Dec 16 15:32:34 +0000 2021,N,La Ou Je Veux ,narthaud sorojeanlouis Les rleurs nont qu faire pareil et lutter pour faire valoir leurs droits,541,0,Arthaud Nathalie
1471419547668389890,Thu Dec 16 09:58:52 +0000 2021,Leo the last07,,narthaud JPierreMercier EN 1956 dans Mythologies Roland Barthes montrait que lusager qui souffre de la grve nest quune construction mythique,1416,3,Arthaud Nathalie
1471463700854984712,Thu Dec 16 12:54:19 +0000 2021,CyBearPunkz,,MaximeFO narthaud Techniquement vous leur demandez daccepter la dgradation de leurs conditions de travail aprs les avoir dj maintes fois rabots pour que vous puissiez rejoindre votre famille  Nol,0,0,Arthaud Nathalie
1471099871499374596,Wed Dec 15 12:48:35 +0000 2021,tvbn,,"Azerty91752101 narthaud Cher camarade de Reconqute 
Mme Arthaud a raison de souligner le manque de pluralisme dans les mdias Soyons cohrents Cest la mme chose pour Asselineau Poutou Cheminade il y a aussi la manire dont sont interviews les politiques  faon caniche ou molosse",84,0,Arthaud Nathalie
1471207363826921472,Wed Dec 15 19:55:43 +0000 2021,Maunau Fabrice,FRANCE,RT collectifmanip lacigale01 narthaud Pourquoi cette question Mlenchon et Nathalie Arthaud nont pas la mme politique et le mme p,1009,1,Arthaud Nathalie
1471381713750310912,Thu Dec 16 07:28:32 +0000 2021,  Lise Bouvet,Paris France,RT nicolambert AnasseKazib FabienRoussel Nous dfoncer la gueule pour au final qumander des parrainages a a peut de chances de mar,2436,6,Arthaud Nathalie
1471122311214469128,Wed Dec 15 14:17:45 +0000 2021,cdland vigilante,Nice France  Cte dAzur,"RT ArielGuez Prsidentielle2022  Sondage Opinionway ralis du 8 au 9 dcembre 
Macron 25
Pcresse 17
Le Pen 16
Zemmour 12",6109,12,Arthaud Nathalie
1471572868609814533,Thu Dec 16 20:08:07 +0000 2021,Benoit Beaurain,Toulouse France,narthaud Total soutient aux grvistes ,121,0,Arthaud Nathalie
1471153198878576642,Wed Dec 15 16:20:29 +0000 2021,Carlo Goldoni,,RT nicolambert AnasseKazib FabienRoussel Nous dfoncer la gueule pour au final qumander des parrainages a a peut de chances de mar,678,6,Arthaud Nathalie
1471776860661075972,Fri Dec 17 09:38:42 +0000 2021,ditions Arthaud,Paris France, Coup de foudre  Un drle de livre  la fois lumineux et ludique InsidePublic recommande Aprs la foudre Un roman sign clairefercak disponible en librairie  httpstcoVVLNOct1hs httpstcoDhLAQOcgyC,1008,0,Arthaud Nathalie
1471539348462002176,Thu Dec 16 17:54:55 +0000 2021,Discovery,Norvge ,gerardfiloche danBlueBirdLo Likakis MehdiHanna GuiraudInd JLMelenchon 2012  Hollande Eva Joly Mlenchon Poutou et Arthaud ,164,0,Arthaud Nathalie
1471747599359168513,Fri Dec 17 07:42:26 +0000 2021,karine75,France,RomainRERC narthaud Comme dans toutes les entreprises de France cqfd,22,0,Arthaud Nathalie
