id,created_at,user_name,user_location,full_text,user_followers_count,retweet_count,Candidat
1471207317848961028,Wed Dec 15 19:55:32 +0000 2021,Maunau Fabrice,FRANCE,RT collectifmanip lacigale01 narthaud Je pense pas nonau contraire mme Mlenchon est un petit Mitterrand et les travailleurs en,1009,1,Arthaud Nathalie
1471482360772415489,Thu Dec 16 14:08:28 +0000 2021,NestlDesert ,In a Hole with my soul,Je rejoins lUnion Populaire avec AnasseKazib PhilippePoutou et narthaud  httpstcob2ZT3h6ySQ,619,0,Arthaud Nathalie
1471248296115064838,Wed Dec 15 22:38:22 +0000 2021,Amaury de SaintAndr,,"Au fait des nouvelles de narthaud  
macron20h",434,0,Arthaud Nathalie
1471499561482944515,Thu Dec 16 15:16:49 +0000 2021,OHara Bndicte,Paris,narthaud LutteOuvriere vous engagerezvous contre la SouffranceAnimale pour une interdiction de llevage des poules en cages L214 PolAnimaux httpstcojx4JUXRNmj EndTheCageAge Animaux2022,91,0,Arthaud Nathalie
1471121946356105217,Wed Dec 15 14:16:18 +0000 2021,38108,,chrislaine33 YvPasco NArthaud a du mrite ,95,0,Arthaud Nathalie
1471785830687641602,Fri Dec 17 10:14:21 +0000 2021,Gordon Amherst,Where ,miher73260 redmapping narthaud Grave je suis dtruit Pardon ,7,0,Arthaud Nathalie
1471549200571711495,Thu Dec 16 18:34:04 +0000 2021,Papy Marcus woke islamogauchiste,Rgion Parisienne,Manzoku35630983 MichelNacou narthaud La grve est un droit Ceux qui pensent quil faut fermer sa gueule face aux abus du patronat feraient mieux de donner lexemple et nous montrer comment ils savent rester stoques,314,0,Arthaud Nathalie
1471448577427841025,Thu Dec 16 11:54:13 +0000 2021,muriel knezek,,RT RemiAngeC narthaud Moi mme en grve aujourdhui avec les collgues de mon entreprise Une centaine de licenciement le 31 mars et au,1279,3,Arthaud Nathalie
1471150196444827652,Wed Dec 15 16:08:34 +0000 2021,Olivier Durand,Paris France,"RT ArielGuez Prsidentielle2022  Sondage Opinionway ralis du 8 au 9 dcembre 
Macron 25
Pcresse 17
Le Pen 16
Zemmour 12",362,12,Arthaud Nathalie
1471097647717302273,Wed Dec 15 12:39:45 +0000 2021,Informer nest pas un dlit,France,"thread
StopConcentrationDesMedias les candidats vous proposez quoi 
emmanuelmacron vpecresse yjadot montebourg MLPofficiel JLMelenchon AnneHidalgo ZemmourEric UPRAsselineau
narthaud
dupontaignan
jeanlassalle
jfpoisson78
PhilippePoutou
FabienRoussel",1905,9,Arthaud Nathalie
1471249795532603395,Wed Dec 15 22:44:20 +0000 2021,Lutti,,Amaurypdsa narthaud Elle avait des copies  corriger Elle bosse elle ,4,0,Arthaud Nathalie
1471106365091467266,Wed Dec 15 13:14:23 +0000 2021,Turenne,,"RT ArielGuez Prsidentielle2022  Sondage Opinionway ralis du 8 au 9 dcembre 
Macron 25
Pcresse 17
Le Pen 16
Zemmour 12",1443,12,Arthaud Nathalie
1471456856719691777,Thu Dec 16 12:27:07 +0000 2021,Fab,LElyse ,narthaud Mfiezvous les amis veautants vous ne votez pas pour un mandat prsidentiel impratif qui rvoquerait votre candidat lu  lElyse surlechamp si ses promesses lectorales ntaient pas respectes,65,0,Arthaud Nathalie
1471453119259230218,Thu Dec 16 12:12:16 +0000 2021,Evergreen,,Thiono5 narthaud GroupeSNCF Et ils sont tellement les rois du ptrole que je comprends pas que tu naies pas encore postul,670,1,Arthaud Nathalie
1471221941474410500,Wed Dec 15 20:53:39 +0000 2021,Adam Thomas,,RT nicolambert AnasseKazib FabienRoussel Nous dfoncer la gueule pour au final qumander des parrainages a a peut de chances de mar,107,6,Arthaud Nathalie
1471173635624914950,Wed Dec 15 17:41:42 +0000 2021,Vronique BLANC,Paris,"RT CollectifINPD thread
StopConcentrationDesMedias les candidats vous proposez quoi 
emmanuelmacron vpecresse yjadot montebourg",405,9,Arthaud Nathalie
1471398498205683717,Thu Dec 16 08:35:13 +0000 2021,Je suis Communiste,Plante Terre et Mars,RT AdrianCourtier FrdrcB FabienRoussel franceinfo Si jlm narrive pas  voir ses parrainage sur les 35000 maires ses son problme en,6259,3,Arthaud Nathalie
1471600599246454785,Thu Dec 16 21:58:18 +0000 2021,sardine94,,RT RemiAngeC narthaud Moi mme en grve aujourdhui avec les collgues de mon entreprise Une centaine de licenciement le 31 mars et au,1631,3,Arthaud Nathalie
1471558172884226053,Thu Dec 16 19:09:43 +0000 2021,Fourmi laborieuse,,narthaud Les enseignants devraient faire pareil,16,0,Arthaud Nathalie
1471658252425482251,Fri Dec 17 01:47:24 +0000 2021,Alexandre Le grand  quiatueSteveetZineb,,RT MarieWe90229652 A droite je viens de compter 10 candidats entre la droite et lextrme droite  A gauche Poutou Arthaud Anasse Hida,961,20,Arthaud Nathalie
1471426002479980546,Thu Dec 16 10:24:31 +0000 2021,Jol Perino ,Dans les Alpes Mont Dolent,narthaud freddelams La gauche me dsespre et va finir par me jeter dans les bras de Macron mais vous vous tes un mystre un opni une objet politique non identifi,197,0,Arthaud Nathalie
1471761352117166082,Fri Dec 17 08:37:05 +0000 2021,NIZA,Ma Touraine,180Masseur51910 MARCLANDES40 BFMTV PhilippePoutou ZemmourEric MLPofficiel JLMelenchon AnneHidalgo yjadot narthaud montebourg vpecresse fphilippot il en reste 1 sur 10  convaincre parmi les peut etre ben que oui peut etre ben que non et il passe au 1er tour,262,0,Arthaud Nathalie
1471787343749296132,Fri Dec 17 10:20:21 +0000 2021,jp,Nantes,"
Comme lon va continuer  regarder mmes Taubira Hidalgo Arthaud et messieurs Jadot Mlenchon et tous ceux des Droites la prsidentielle cette fois est un grand Cirque les candidats sont devenus des circassiens Au moins avonsnous le Cirque  domicile et sans masque
 httpstcoX3ZNgfHbCa httpstcotGp3650BpU",2,0,Arthaud Nathalie
1471691707762843652,Fri Dec 17 04:00:20 +0000 2021,JAMNET EL BISMUSTASI,La Role 33190,narthaud Depuis Louis Gallois que des nazes,12489,0,Arthaud Nathalie
1471574110274789379,Thu Dec 16 20:13:03 +0000 2021,El Conductor Professor,Ple nord,"Menestrelethaga narthaud Et  Vous avez t cheminot  Non mais pourtant vous avez un avis sur le travail de ces derniers Vous savez peuttre quil ny a pas que la fatigue physique dans la vie
Vous pouvez peuttre mexpliquer pourquoi aprs 5 jours de travail  alterner les prise de service",355,0,Arthaud Nathalie
1471785036542320647,Fri Dec 17 10:11:11 +0000 2021,rodriguez jc,Couron France,RT MarieWe90229652 A droite je viens de compter 10 candidats entre la droite et lextrme droite  A gauche Poutou Arthaud Anasse Hida,793,20,Arthaud Nathalie
1471122029449519104,Wed Dec 15 14:16:38 +0000 2021,edperrin,Paris France,"RT CollectifINPD thread
StopConcentrationDesMedias les candidats vous proposez quoi 
emmanuelmacron vpecresse yjadot montebourg",2962,9,Arthaud Nathalie
1471137585556828164,Wed Dec 15 15:18:27 +0000 2021,DENIS Claudine,AGDE,"RT ArielGuez Prsidentielle2022  Sondage Opinionway ralis du 8 au 9 dcembre 
Macron 25
Pcresse 17
Le Pen 16
Zemmour 12",1407,12,Arthaud Nathalie
1471098642257915912,Wed Dec 15 12:43:42 +0000 2021,Alain NEL ToujoursCharlie ,,steevenoscorpio narthaud Cela respecte largement la reprsentativit de ce micro parti donc je maintiens,227,0,Arthaud Nathalie
1471453910690844674,Thu Dec 16 12:15:25 +0000 2021,BrettDeKampf,,"narthaud Domiala Ouais et te prsenter 10 fois pr diviser les voix de gauche na rien chang
Mais tu vas persister videmment Tant pis si a permet  lextrme droite de gagner mettant en danger de nbreux ouvriers et prcaires issus d minorits
Aprs tu fais croire q c pr eux q tu le fais",299,1,Arthaud Nathalie
1471504892267167750,Thu Dec 16 15:38:00 +0000 2021,Biodgradable,,Frederi30847226 KampfDe narthaud Domiala Nan mais laisse le castor il na pas connaissance de ce quest le principe dune Dmocratie,77,0,Arthaud Nathalie
1471441731694563330,Thu Dec 16 11:27:01 +0000 2021,ortilla,,"narthaud Pourquoi vous ne dites pas la vrit au franais 
Ce nest pas 8 ans de gel salarial cest gel du point dindice Mais les salaires ont augment  la SNCF Pas autant que vous le souhaitez mais vous nallez pas voir ailleurs parce que ce nest pas mieux",8,0,Arthaud Nathalie
1471767618759675906,Fri Dec 17 09:01:59 +0000 2021,Carolina Tibou,,RT MarieWe90229652 A droite je viens de compter 10 candidats entre la droite et lextrme droite  A gauche Poutou Arthaud Anasse Hida,866,20,Arthaud Nathalie
1471439627101818880,Thu Dec 16 11:18:39 +0000 2021,JeanEusbe du BB67000,prs dun Train,"Alors je vais peut tre passer pour un con mais pourquoi Poutou Kazib et Arthaud peuvent pas faire liste commune dj 
Cest quoi les points de dsaccords irrconciliables que je comprenne un peu ",663,1,Arthaud Nathalie
1471207224106172422,Wed Dec 15 19:55:10 +0000 2021,Maunau Fabrice,FRANCE,RT collectifmanip lacigale01 narthaud Mlenchon comme Roussel ou Jadot font de belles promesses Mais ils ne remettent pas en cause le,1009,1,Arthaud Nathalie
1471549707969253380,Thu Dec 16 18:36:05 +0000 2021,Papy Marcus woke islamogauchiste,Rgion Parisienne,Manzoku35630983 MichelNacou narthaud Mais si vous pensez que louverture  la concurrence permet dviter les grves vous pouvez toujours rver,314,0,Arthaud Nathalie
1471194639931686912,Wed Dec 15 19:05:10 +0000 2021,Arnaud Frexit ,Paris France ,narthaud Effectivement cest un scandale ,1365,0,Arthaud Nathalie
1471121696711225350,Wed Dec 15 14:15:19 +0000 2021,Simone LInsoumise, Ta Gauche,tvbn2 Azerty91752101 narthaud Grand bien leur fassent,28,0,Arthaud Nathalie
1471201451330486273,Wed Dec 15 19:32:14 +0000 2021,Marianne,,narthaud Trs drle javoue jai ri tellement vrai des charognards,22,0,Arthaud Nathalie
1471523009680875528,Thu Dec 16 16:49:59 +0000 2021,Malika Alkama,,Europe1 SoMabrouk A quel titre que diratil de nouveau Faites nous rver Europe1 invitez Madame Arthaud Messieurs Poutou et KazibL entre soi a suffit,564,0,Arthaud Nathalie
1471772366107783172,Fri Dec 17 09:20:50 +0000 2021,Cy Rille,,chachasenior narthaud Dveloppez ces avantages ,734,0,Arthaud Nathalie
1471601637726765068,Thu Dec 16 22:02:26 +0000 2021,sardine94,,"chismeres narthaud AHcCamille en banlieue pendant trs longtemps la sncf faisait EXPRES dannoncer les grves au dernier moment pour nerver les usagers 
la direction EST responsable",1631,0,Arthaud Nathalie
1471442023009955844,Thu Dec 16 11:28:11 +0000 2021,Exinbreez,,"RT Jeaneusebe Alors je vais peut tre passer pour un con mais pourquoi Poutou Kazib et Arthaud peuvent pas faire liste commune dj 
C",76,1,Arthaud Nathalie
1471605989858320393,Thu Dec 16 22:19:43 +0000 2021,toyette,,miher73260 Scribouillus narthaud Sais tu pourquoi il faut renflouer les caisses de la sncf  Sous mitterand ltat franais stait engag envers la sncf  financer le projet Tgv La sncf sest par consquent endett pour le financement mais ltat na pas tenu ses engagements et a laiss la sncf se dmerder,7,0,Arthaud Nathalie
1471453036111405056,Thu Dec 16 12:11:56 +0000 2021,GoMarxiste,,"miher73260 narthaud Le salaire moyen en incluant le salaire du PDG ou non  a risque de pas mal influencer la valeur du salaire moyen

Et les cheminots pendant les confinements ils se sont tourns les pouces  Les trains sont devenus soudainement automatiques ",93,0,Arthaud Nathalie
1471604042308673537,Thu Dec 16 22:11:59 +0000 2021,toyette,,miher73260 narthaud Quest ce que tu nous les brises avec ta caisse syndicale de la cfdt Je te rpte que jai jamais t cfdt qui est un syndicat rformiste qui a vendu nos retraites au patronat en magouillant avec les socialistes,7,0,Arthaud Nathalie
1471499122628694020,Thu Dec 16 15:15:04 +0000 2021,SAUTY,,narthaud LutteOuvriere vous engagerezvous contre la SouffranceAnimale pour une interdiction de llevage des poules en cages L214 PolAnimaux httpstcoGWoyO2Uwwi EndTheCageAge Animaux2022,40,0,Arthaud Nathalie
1471257379740266498,Wed Dec 15 23:14:28 +0000 2021,Fab,Bordeaux France,jeangarr78 Rajoutons aussi les mdiocres PhilippePoutou narthaud ou encore IanBrossat qui ne reprsentent rien et qui donnent des leons Au maximum 3 des intentions de vote,262,0,Arthaud Nathalie
1471153347776421896,Wed Dec 15 16:21:05 +0000 2021,Marc Perrien,Rennes,"enisseo Arthaud Poutou Mlenchon et Taubira Jen compte 4

Mais jai aussi mis ceux qui se croient de gauche et ceux qui se disent de gauche sans que je ne sache qui classer o

Cest qui ton 05 ",669,0,Arthaud Nathalie
1471408135537577984,Thu Dec 16 09:13:31 +0000 2021,ditions Arthaud,Paris France,Passionnante fable o les animaux prennent la parole pour dnoncer notre drive LAssemble des animaux de Filelfo est mis  lhonneur dans Femme Actuelle Jeux Animo Louvrage est  dcouvrir en librairie  httpstcoCWAPoPF4Wo httpstcoQ6qEiBtRx8,1008,0,Arthaud Nathalie
1471592326896234511,Thu Dec 16 21:25:26 +0000 2021,Eric Desmet,,TF1LeJT LCI narthaud TF1 Pourquoi encore vous prsenter Vous croyez encore que l on vous coute Vous tes des plus ridicules Le communisme est mort depuis 1989 Mme les chinois sont les premiers capitalistes,0,0,Arthaud Nathalie
1471448601461207045,Thu Dec 16 11:54:19 +0000 2021,muriel knezek,,RT Leothelast07 narthaud JPierreMercier EN 1956 dans Mythologies Roland Barthes montrait que lusager qui souffre de la grve nest,1279,3,Arthaud Nathalie
1471258912930377735,Wed Dec 15 23:20:34 +0000 2021,LCI Politique,France,"RT TF1LeJT Sur le grand Entretien dEmmanuel Macron

  narthaud   On a eu droit  2h dexercice dautosatisfaction La ralit",186474,7,Arthaud Nathalie
1471424546444038149,Thu Dec 16 10:18:44 +0000 2021,R3iLab,Paris,Le replay du MeetUp est prt  Merci  tous davoir particip  ce premier rendezvous consacr aux Mtaverses NFT avec Thibaut Arthaud HavasSEFr   Matthieu Py GameWardTeam  Julien PAJOT  orivardcohen  httpstcoxn0ucSCEhq httpstco0WrSxyqGUr,1405,2,Arthaud Nathalie
1471434456737136643,Thu Dec 16 10:58:07 +0000 2021, Im Khady,Terre de Feu Antarctique et ,narthaud LutteOuvriere  vous engagerezvous contre la SouffranceAnimale pour une interdiction de llevage des poules en cages L214 PolAnimaux httpstco0gfG8dTCNR EndTheCageAge Animaux2022,857,1,Arthaud Nathalie
1471496878000787467,Thu Dec 16 15:06:09 +0000 2021,Behar dit Philou,,wibje framboiseneige sardine33000 A choisir je prfrerais une grosse Arthaud,336,0,Arthaud Nathalie
1471668631436251137,Fri Dec 17 02:28:38 +0000 2021,Jrme Jal,Aussonne France,narthaud Rejoignez LFI pour le combat,439,0,Arthaud Nathalie
1471099943091847175,Wed Dec 15 12:48:52 +0000 2021,Tiphaine BdLomnie,,"RT CollectifINPD thread
StopConcentrationDesMedias les candidats vous proposez quoi 
emmanuelmacron vpecresse yjadot montebourg",512,9,Arthaud Nathalie
1471166085835767813,Wed Dec 15 17:11:42 +0000 2021,Andrea Rossi,,EvanPlard narthaud En effet je suis plutt daccord avec vous,1047,0,Arthaud Nathalie
1471145736301686786,Wed Dec 15 15:50:50 +0000 2021,Captain vodka,NordPasdeCalais France,narthaud MylasMoon Cest encore beaucoup trop 3 minutes pour entendre autant de conneries ,139,0,Arthaud Nathalie
1471594930246144005,Thu Dec 16 21:35:46 +0000 2021,Stella,,narthaud AHcCamille Train annul pour cause de grve  15  non rembourss Je ne compatis pas dsole,2277,0,Arthaud Nathalie
1471121295886671885,Wed Dec 15 14:13:43 +0000 2021,Gagnier,,"RT CollectifINPD thread
StopConcentrationDesMedias les candidats vous proposez quoi 
emmanuelmacron vpecresse yjadot montebourg",2062,9,Arthaud Nathalie
1471779496965689344,Fri Dec 17 09:49:11 +0000 2021,LEGRAND Maxime,,miher73260 narthaud Je rectifie avant de vous cultiver apprenez les rgles de ponctuations Votre top 5 des ides reues sur les fonctionnaires est incomprhensible,7,0,Arthaud Nathalie
1471430155646156807,Thu Dec 16 10:41:01 +0000 2021,GoMarxiste,,ManuelddRainha Quappellestu lunit  Nathalie Arthaud et LO sont favorables  lunion des travailleurs contre la bourgeoisie Le fait que ces travailleurs ici les cheminots se regroupent dans des syndicats pour dfendre leurs droits est un premier pas dans cette direction,93,0,Arthaud Nathalie
1471724905557381120,Fri Dec 17 06:12:15 +0000 2021,Stella,,PlusUnIdealiste narthaud AHcCamille La retraite cest  quel ge pour les cheminots ,2277,0,Arthaud Nathalie
1471554741490667521,Thu Dec 16 18:56:05 +0000 2021,Legrec Sisyphe,,"LiliPerles GWGoldnadel Ne vous en dplaise mais Melenchon Arthaud Roussel Jadot Montebourg sont des candidats dextrme gauche
Il y a foule  la gauche de la gauche",12,0,Arthaud Nathalie
1471376522879635457,Thu Dec 16 07:07:54 +0000 2021,Ben Brrd,Lille France,RT SRMLeMonde Le candidat FabienRoussel sengage sur lappel des socits de journalistes pour une libre couverture de la campagne pr,495,33,Arthaud Nathalie
1471177906911162373,Wed Dec 15 17:58:40 +0000 2021,CNAJEP,12 rue Tolain 75020 paris,Intervention de narthaud LutteOuvriere accueillie sur scne par CrajepNA Elections2022 Cnajep15Dec httpstcowaYPBwvQBw,3862,1,Arthaud Nathalie
1471408574538596366,Thu Dec 16 09:15:16 +0000 2021,Gaspard Prepuz Journaliste,,narthaud encore un peu de patience a sera bientt fini la sncf,57,0,Arthaud Nathalie
1471577570944733184,Thu Dec 16 20:26:48 +0000 2021,Menestrel Zorol,Pays de loire ,RT MarieWe90229652 A droite je viens de compter 10 candidats entre la droite et lextrme droite  A gauche Poutou Arthaud Anasse Hida,147,20,Arthaud Nathalie
1471430706337304582,Thu Dec 16 10:43:12 +0000 2021,Esperelle,,narthaud LutteOuvriere  vous engagerezvous contre la SouffranceAnimale pour une interdiction de llevage des poules en cages L214 PolAnimaux httpstcoXHTtdQcY3R EndTheCageAge Animaux2022,46,0,Arthaud Nathalie
1471155413420806147,Wed Dec 15 16:29:17 +0000 2021,Lemonnier Jean Pierre,HauteNormandie France,MinaOpale narthaud Questce qui fait que les franais sont mcontents dans lensemble mais que  titre individuel 8 sur 10 se dclarent heureux     Schizophrnie nationale  Comme disait Louis XVI la France compte 32 millions de sujets sans compter les sujets de mcontentement,28,0,Arthaud Nathalie
1471124407544332293,Wed Dec 15 14:26:05 +0000 2021,Fab,LElyse ,narthaud La France vit en tat durgence permanent dans un tat de nondroit la 5me Rpublique est un rgime politique totalitaire,65,0,Arthaud Nathalie
1471370987195228166,Thu Dec 16 06:45:54 +0000 2021,phdes,,TF1LeJT LCI narthaud TF1 Discours de 1950 ,6,0,Arthaud Nathalie
1471743067346591747,Fri Dec 17 07:24:25 +0000 2021,Romain,JuvisysurOrge France,TonyHawk692 PunkzCy MaximeFO narthaud Sauf que de 1 cest pas lgal et surtout en idf la majorit des gens on un abonnement mensuel donc a marche pas trop votre proposition ,515,0,Arthaud Nathalie
1471426146961088512,Thu Dec 16 10:25:05 +0000 2021,LAURENCE SARRAZIN,,narthaud LutteOuvriere  vous engagerezvous contre la SouffranceAnimale pour une interdiction de llevage des poules en cages L214 PolAnimaux httpstcogpWcKppmS8 EndTheCageAge Animaux2022,15,0,Arthaud Nathalie
1471204480154804233,Wed Dec 15 19:44:16 +0000 2021,Valerie Dumeige,Paris France,RT EditionsArthaud Il faut un petit grain de folie pour faire avancer la science et l on peut vraiment compter sur Corentin de Chatelp,450,1,Arthaud Nathalie
1471460127312171009,Thu Dec 16 12:40:07 +0000 2021,JeanCharles Germain,France  Suisse,narthaud Louverture  la concurrence est inluctable A force de faire grve et de prendre les clients en otage la SNCF est passe  ct de ce quest devenu le transport par rail en Europe Mais a il ny que les syndicats qui ne le comprennent pas en dfendant leurs petits privilges,90,0,Arthaud Nathalie
1471260705412329474,Wed Dec 15 23:27:41 +0000 2021,Olivier Biffaud,France,"Donc opinionway a eu la bonne ide dajouter une 8e candidate des gauches  llection prsidentielle pour mesurer les intentions de vote et voil ce que a donne
Mlenchon 8
Jadot 8
Hidalgo 5
Poutou 2
Roussel 2
Taubira 2
Arthaud 1
Montebourg 1 
Soit un total de 29  httpstcounvboA8z6R",14092,1,Arthaud Nathalie
1471132438201917440,Wed Dec 15 14:58:00 +0000 2021,Jol Perino ,Dans les Alpes Mont Dolent,alouettedeter ArthurLimi zebulon62941496 Quant  Poutou Roussel Anasse Kazib ou Nathalie Arthaud cela fait des annes que je constate que toutes les obdiences de ce bord extrme ne saiment pas JLMelenchon  et son ego surdimensionn ne faillit pas  la rgle,197,0,Arthaud Nathalie
1471109687366008839,Wed Dec 15 13:27:36 +0000 2021,Stiiv Vn Cambl ,,CoornaertBenoit narthaud Il est en campagne que vous le vouliez ou non,18,0,Arthaud Nathalie
1471628697337839621,Thu Dec 16 23:49:57 +0000 2021,Unam Zvlac,France,toyette2 miher73260 Scribouillus narthaud Et pourtant selon les commissaires aux comptes lorigine de la dette ferait consensus extraits du projet de loi de finance pour 2020 httpstcolo9q6npSq2,16,0,Arthaud Nathalie
1471443247788613634,Thu Dec 16 11:33:03 +0000 2021,RmiAnge Couzinet,Roubaix France,narthaud Moi mme en grve aujourdhui avec les collgues de mon entreprise Une centaine de licenciement le 31 mars et aucun dialogue avec la direction qui ne veut pas de PSE patronsVoyous,821,3,Arthaud Nathalie
1471756979001597952,Fri Dec 17 08:19:42 +0000 2021,Maxencia,Niort France,RT MarieWe90229652 A droite je viens de compter 10 candidats entre la droite et lextrme droite  A gauche Poutou Arthaud Anasse Hida,538,20,Arthaud Nathalie
1471753880484683779,Fri Dec 17 08:07:23 +0000 2021,Chahadaman,,"narthaud Moi je ne suis pas content de mon taf  je me casse
Mais pour a il faut des couilles",16,0,Arthaud Nathalie
1471338239755702272,Thu Dec 16 04:35:47 +0000 2021,VBWFR,Vannes France,narthaud BrunoBertez Oui mais faut allez vivre en Chine l o vos propos ont envoyez la productions de richesses ou Core du Nord pour vous ce que vous voulez ,87,0,Arthaud Nathalie
1471572387430899715,Thu Dec 16 20:06:12 +0000 2021,El Conductor Professor,Ple nord,MmMi94903538 narthaud Vous ntes pas au courant mais a fait des mois que la ngociation a t initi Sans aucun geste de la direction,355,0,Arthaud Nathalie
1471461083512815621,Thu Dec 16 12:43:55 +0000 2021,Frederic,,KampfDe narthaud Domiala Rien ne tempches de voter pour elle Cest elle qui divise la gauche ou les autres,0,0,Arthaud Nathalie
1471457530337546242,Thu Dec 16 12:29:48 +0000 2021,Evergreen,,MisstickAnne narthaud zefrouletabille Mdr oui donc tous les cheminots dmissionnent et on va tous pouvoir les reclasser ailleurs ,670,0,Arthaud Nathalie
1471362519411347459,Thu Dec 16 06:12:15 +0000 2021, l,Bdddjo,narthaud BrunoBertez Depuis que vous avez arrt la navigation vous tes rentre dans lombre,0,0,Arthaud Nathalie
1471217525501349888,Wed Dec 15 20:36:06 +0000 2021,Christian Domin,IledeFrance France,RT Cnajep Premire partie de soire riche avec FrancasFede MRJCcom partisocialiste CardonRemi Anacej JeunesEuropeens juniorsasso,3377,1,Arthaud Nathalie
1471547642102616072,Thu Dec 16 18:27:52 +0000 2021,Scribouillus,,"miher73260 toyette2 narthaud Pendant ce temps 80 milliards de fraude fiscale annuelle
La paille et la poutre  cest connu",5,1,Arthaud Nathalie
1471454396206747651,Thu Dec 16 12:17:21 +0000 2021,GoMarxiste,,"miher73260 narthaud Ah mince  Je suis un salari dans le priv et je fais grve Suisje un ET 

Et les fonctionnaires ne sont pas pays lors dune grve comme dans le priv Mme qu lEN qqes profs ne sont pas pays lors de jours de grves alors quils ny participaient pas",93,0,Arthaud Nathalie
1471121584375189514,Wed Dec 15 14:14:52 +0000 2021,Simone LInsoumise, Ta Gauche,"tvbn2 Azerty91752101 narthaud Barrage  quoi  
Entre un employ de milliardaires et un autre employ de milliardaires si cest Zemmour quelle est la diffrence",28,0,Arthaud Nathalie
1471549743658676237,Thu Dec 16 18:36:13 +0000 2021,Magali R,Suresnes France,narthaud Et les autres ils ne foutent rien peut tre  Ils nont pas le droit dtre avec leurs proches  Nol  Lamentable,2,0,Arthaud Nathalie
1471541329826037768,Thu Dec 16 18:02:47 +0000 2021,debe1962,,RT docgill95 libe AnasseKazib RevPermanente 3e trotskyste candidat avec Arthaud et Poutou  Lui cest la branche identitaire sparati,23,3,Arthaud Nathalie
1471421538889048069,Thu Dec 16 10:06:47 +0000 2021,labat jean,Anglet France,RT Leothelast07 narthaud JPierreMercier EN 1956 dans Mythologies Roland Barthes montrait que lusager qui souffre de la grve nest,439,3,Arthaud Nathalie
1471429834291167232,Thu Dec 16 10:39:44 +0000 2021,Bong,,narthaud Si ils sont pas comptant des travailleurs immigres feront le boulot pour beaucoup moins queux,0,0,Arthaud Nathalie
1471120309466054656,Wed Dec 15 14:09:48 +0000 2021,FailNino,,tvbn2 Azerty91752101 narthaud Mon graphique vient juste confirmer les dires de Nathalie Arthaud sur le temps de parole,3,0,Arthaud Nathalie
1471373658039988226,Thu Dec 16 06:56:31 +0000 2021,Taliban inclusif,Paris  Lile dOlron,narthaud Bah je vous aime bien mais 32h  couter vos litanies cest long Dautant que le discours est le mme depuis quarante ans donc on sait bien ce quil y a dedans Bref cest pas  cause du temps de parole que vos ides ne passent pas mais votre prsence est importante,432,0,Arthaud Nathalie
1471169571109359623,Wed Dec 15 17:25:33 +0000 2021,Cryptonitch ,LYON France,franck77120 chamiots JLMelenchon yjadot JLMelenchon AnneHidalgo narthaud montebourg FabienRoussel galement prsents avec beaucoup dautres dans le jeu cryptopolitic by civicpowerio bientt dans les store mobile Apple et Google httpstcoFc4AYtDbEs,384,1,Arthaud Nathalie
1471103288078704641,Wed Dec 15 13:02:10 +0000 2021,FailNino,,tvbn2 Azerty91752101 narthaud Je pense que les gens aimeraient surtout que le temps de parole soit reparti quitablement Chaque candidat devrait pouvoir sexprimer autant que Zemmour httpstcoOsCBBEuvdY,3,0,Arthaud Nathalie
1471496984691310601,Thu Dec 16 15:06:34 +0000 2021,Camille Kissinger,France,"lemondefr Avec Poutou ministre de lconomie 
Roussel aux anciens combattants  
Arthaud aux sports et Mlenchon comme ministre de lAmrique Latine",94,0,Arthaud Nathalie
1471134677457113093,Wed Dec 15 15:06:54 +0000 2021,lallier michel,Les SablesdOlonne France,"RT ArielGuez Prsidentielle2022  Sondage Opinionway ralis du 8 au 9 dcembre 
Macron 25
Pcresse 17
Le Pen 16
Zemmour 12",1928,12,Arthaud Nathalie
1471450427791228932,Thu Dec 16 12:01:34 +0000 2021,Samuel Lveill,,Aujourdhui on dit Arthaud nest jamais invit jai 2 rponses en mme temps qui votera pour elle bah oui puisquelle nentre pas dans le cerveau des gens  coup de tlvision H24 elle et sinon a fait pas daudience donc genre on arrte de parler cancer du sein,419,0,Arthaud Nathalie
